{
  "server": {
    "port": 8080,
    "host": "127.0.0.1",
    "environment": "development"
  },
  "database": {
    "host": "localhost",
    "port": 5432,
    "name": "flexgate_bench",
    "user": "flexgate",
    "password": "flexgate",
    "ssl": false,
    "poolMin": 2,
    "poolMax": 20
  },
  "redis": {
    "host": "localhost",
    "port": 6379,
    "password": "",
    "db": 1
  },
  "security": {
    "corsOrigins": ["*"],
    "corsEnabled": false,
    "rateLimitEnabled": false,
    "rateLimitWindowMs": 60000,
    "rateLimitMaxRequests": 100000
  },
  "logging": {
    "level": "warn"
  },
  "monitoring": {
    "metricsEnabled": false,
    "prometheusPort": 9090,
    "healthCheckInterval": 60000
  }
}
